function,description,comment,example
dax_query,"Executes a DAX query against a Power BI Semantic Model and returns the result as a DuckDB table.","Supports named authentication parameters and DuckDB azure secret auth via secret_name or Secret= in the connection string.","SELECT * FROM dax_query('Data Source=powerbi://api.powerbi.com/v1.0/myorg/Example%20Workspace;Initial Catalog=example_semantic_model;','EVALUATE TOPN(500, FactSales)');"
pbi_tables,"Returns semantic model table metadata via INFO.VIEW.TABLES().","Uses the same named parameters as dax_query (auth_mode, access_token, secret_name, tenant_id, client_id, client_secret, effective_user_name, timeout_ms).","SELECT * FROM pbi_tables('Data Source=powerbi://api.powerbi.com/v1.0/myorg/Example%20Workspace;Initial Catalog=example_semantic_model;');"
pbi_columns,"Returns semantic model column metadata via INFO.VIEW.COLUMNS().","Uses the same named parameters as dax_query (auth_mode, access_token, secret_name, tenant_id, client_id, client_secret, effective_user_name, timeout_ms).","SELECT * FROM pbi_columns('Data Source=powerbi://api.powerbi.com/v1.0/myorg/Example%20Workspace;Initial Catalog=example_semantic_model;');"
pbi_measures,"Returns semantic model measure metadata via INFO.VIEW.MEASURES().","Uses the same named parameters as dax_query (auth_mode, access_token, secret_name, tenant_id, client_id, client_secret, effective_user_name, timeout_ms).","SELECT * FROM pbi_measures('Data Source=powerbi://api.powerbi.com/v1.0/myorg/Example%20Workspace;Initial Catalog=example_semantic_model;');"
pbi_relationships,"Returns semantic model relationship metadata via INFO.VIEW.RELATIONSHIPS().","Uses the same named parameters as dax_query (auth_mode, access_token, secret_name, tenant_id, client_id, client_secret, effective_user_name, timeout_ms).","SELECT * FROM pbi_relationships('Data Source=powerbi://api.powerbi.com/v1.0/myorg/Example%20Workspace;Initial Catalog=example_semantic_model;');"
