"function"            , "description"                                                                , "comment", "example"
"onelake_attach"      , "Attach to a OneLake workspace and lakehouse."                               , ""       , "ATTACH 'workspace/lakehouse.Lakehouse' AS my_lakehouse (TYPE ONELAKE);"
"onelake_scan"        , "Scan a Delta table from the attached lakehouse."                            , ""       , "SELECT * FROM my_lakehouse.my_schema.my_table;"
"onelake_iceberg_scan", "Scan an Iceberg table from the attached lakehouse using the ICEBERG syntax.", ""       , "SELECT * FROM my_lakehouse.my_schema.my_table USING ICEBERG;"
"onelake_secret"      , "Create a secret for OneLake authentication."                                , ""       , "CREATE SECRET my_secret (TYPE ONELAKE, TENANT_ID '...', CLIENT_ID '...', CLIENT_SECRET '...');"
"onelake_secret_chain", "Create a secret using the credential chain provider."                       , ""       , "CREATE SECRET my_chain (TYPE ONELAKE, PROVIDER credential_chain, CHAIN 'env');"
"onelake_write"       , "Insert data into a OneLake table."                                          , ""       , "INSERT INTO my_lakehouse.my_schema.my_table SELECT * FROM source_table;"
"onelake_create_table", "Create a new Delta table in OneLake."                                       , ""       , "CREATE TABLE my_lakehouse.my_schema.new_table (id INT) PARTITION BY (id);"
"onelake_drop_table"  , "Drop a table from OneLake."                                                 , ""       , "DROP TABLE my_lakehouse.my_schema.my_table;"