function,description,comment,example
"extract_domain","Extracting the main domain from a URL","","SELECT extract_domain('a.example.com') as domain;"
"extract_host","Extracting the hostname from a URL","","SELECT extract_host('https://b.a.example.com/path/path') as host;"
"extract_path","Extracting the path from a URL","","SELECT extract_path('example.com/path/path/image.png') as path;"
"extract_query_string","Extracting the query string from a URL","","SELECT extract_query_string('example.com?key=value') as query;"
"extract_query_parameters","Extracting the query parameters from a URL","","SELECT * FROM extract_query_parameters('example.com?key=value&key2=value2');"
"extract_schema","Extracting the schema from a URL","","SELECT extract_schema('mailto:someone@example.com') as schema;"
"extract_subdomain","Extracting the subdomain from a URL","","SELECT extract_subdomain('test.example.com.ac') as dns_record;"
"extract_tld","Extracting the top-level domain from a URL","","SELECT extract_tld('a.example.com') as tld;"
"is_valid_ip","Validates IPv4 and IPv6 addresses","","SELECT is_valid_ip('192.168.1.1');"
"is_private_ip","Checks if an IP belongs to a private/reserved range (15 IPv4 + 7 IPv6 ranges)","","SELECT is_private_ip('10.0.0.1');"
"ip_to_int","Converts IPv4 to 32-bit unsigned integer","","SELECT ip_to_int('192.168.1.1');"
"int_to_ip","Converts integer back to IPv4 dotted-quad notation","","SELECT int_to_ip(3232235777::UBIGINT);"
"ip_version","Returns `4` (IPv4), `6` (IPv6), or `NULL` (invalid)","","SELECT ip_version('::1');"
"ipcalc","Calculating IP information from a CIDR notation","","SELECT * FROM ipcalc('192.168.1.0/24');"
"get_tranco_rank","Getting the Tranco rank of a domain","","SELECT get_tranco_rank('cloudflare.com') as rank;"
"normalize_url","Normalizes a URL by applying RFC 3986 rules (lowercasing, default port removal, dot resolution, query sorting, fragment removal)","","SELECT normalize_url('HTTP://WWW.EXAMPLE.COM:80/a/b/../c/?z=1&a=2#frag') AS url;"
"extract_fragment","Extracts the fragment (after #) from a URL","","SELECT extract_fragment('http://example.com/page#section') AS fragment;"
"domain_depth","Returns the number of dot-separated levels in a domain","","SELECT domain_depth('www.example.com') AS depth;"
"base64_encode","Encodes a string into Base64 format","","SELECT base64_encode('Hello World') AS encoded;"
"base64_decode","Decodes a Base64-encoded string back to its original form","","SELECT base64_decode('SGVsbG8gV29ybGQ=') AS decoded;"
"is_valid_url","Checks whether a string is a well-formed URL with scheme, authority, and host","","SELECT is_valid_url('https://example.com');"
"is_valid_domain","Validates a domain name against RFC 1035 / RFC 1123 rules","","SELECT is_valid_domain('example.com');"
"update_suffixes","Update public suffixes","","SELECT update_suffixes();"
"update_tranco","Update tranco data","","SELECT update_tranco(true);"
