format,description,parameters,example
FORMAT FASTQ,"Write query results to FASTQ format. Supports single-end, paired-end, and interleaved output.","QUAL_OFFSET, INCLUDE_COMMENT, ID_AS_SEQUENCE_INDEX, INTERLEAVE, COMPRESSION","COPY (SELECT * FROM read_fastx('input.fastq')) TO 'output.fastq.gz' (FORMAT FASTQ);"
FORMAT FASTA,"Write query results to FASTA format. Supports single-end, paired-end, and interleaved output.","INCLUDE_COMMENT, ID_AS_SEQUENCE_INDEX, INTERLEAVE, COMPRESSION","COPY (SELECT * FROM read_fastx('input.fasta')) TO 'output.fasta' (FORMAT FASTA);"
FORMAT SAM,"Write query results to SAM (text) alignment format. Supports optional headers with reference lengths.","INCLUDE_HEADER, REFERENCE_LENGTHS, COMPRESSION","COPY (SELECT * FROM read_alignments('input.bam')) TO 'output.sam' (FORMAT SAM, REFERENCE_LENGTHS 'refs');"
FORMAT BAM,"Write query results to BAM (binary) alignment format. Headers are always required.","REFERENCE_LENGTHS, COMPRESSION_LEVEL (0-9)","COPY (SELECT * FROM read_alignments('input.sam')) TO 'output.bam' (FORMAT BAM, REFERENCE_LENGTHS 'refs');"
FORMAT BIOM,"Write query results to BIOM (Biological Observation Matrix) HDF5 format. Automatic deduplication and sparse optimization.","COMPRESSION (gzip/lzf/none), ID, GENERATED_BY","COPY (SELECT * FROM woltka_ogu_per_sample(aln, sample_id, read_id)) TO 'table.biom' (FORMAT BIOM, COMPRESSION 'gzip');"
FORMAT NEWICK,"Write query results to Newick phylogenetic tree format. Reconstructs tree from tabular node data.","EDGE_IDS, COMPRESSION, PLACEMENTS","COPY (SELECT * FROM read_newick('input.nwk')) TO 'output.nwk' (FORMAT NEWICK);"
